[
  { "id": "lexicon", "name": "Published music lexicon and ranked list (comment on issue 101)", "url": "https://github.com/Akurganow/sound-to-patch/issues/101#issuecomment-6393746249", "licence": "MIT, as this repository", "use": "copy" },
  { "id": "guides", "name": "Producer guides and tutorials on scales, chords, voicing, rhythm and technique, about 70 pages, listed by kind in the lexicon", "url": "https://github.com/Akurganow/sound-to-patch/issues/101#issuecomment-6393746249", "licence": "no licence stated", "use": "facts only" },
  { "id": "genre-guide", "name": "An electronic genre guide", "url": "https://beatkitchen.io/guides/electronic-music/01-genre-landscape", "licence": "CC BY-NC-SA 4.0", "use": "facts only" },
  { "id": "tonal", "name": "tonal: chord, scale and Roman-numeral tables", "url": "https://github.com/tonaljs/tonal", "licence": "MIT", "revision": "e555422", "use": "facts only" },
  { "id": "pychord", "name": "pychord: chord-quality table", "url": "https://github.com/yuma-m/pychord", "licence": "MIT", "revision": "91d3afc", "use": "facts only" },
  { "id": "music21", "name": "music21: music library", "url": "https://github.com/cuthbertLab/music21", "licence": "BSD-3-Clause", "use": "facts only" },
  { "id": "mir-eval", "name": "mir_eval: evaluation library", "url": "https://github.com/mir-evaluation/mir_eval", "licence": "MIT", "revision": "fe73b35", "use": "facts only" },
  { "id": "chordparser", "name": "chordparser: chord-symbol parser crate", "url": "https://github.com/PauSala/chordparser", "licence": "MIT", "revision": "4.0.4", "use": "facts only" },
  { "id": "rust-music-theory", "name": "rust-music-theory: scale and chord crate", "url": "https://github.com/ozankasikci/rust-music-theory", "licence": "MIT", "revision": "0.4.0", "use": "facts only" },
  { "id": "euclid-paper", "name": "G. Toussaint, The Euclidean Algorithm Generates Traditional Musical Rhythms, Bridges 2005", "url": "http://cgm.cs.mcgill.ca/~godfried/publications/banff.pdf", "licence": "no licence stated", "use": "facts only" },
  { "id": "wiki", "name": "English Wikipedia pages on scales, chords, progressions and rhythms", "url": "https://en.wikipedia.org/wiki/List_of_musical_scales_and_modes", "licence": "CC BY-SA 4.0", "use": "facts only" },
  { "id": "chart-chords", "name": "McGill Billboard chord and key annotations 2.0, through the mirdata loader", "url": "https://github.com/mir-dataset-loaders/mirdata", "licence": "CC0 per its loader", "revision": "md5 6954a6fad962a111e69c9c80cb87d3a5", "use": "counts only" },
  { "id": "sheet-chords", "name": "Chordonomicon chord sheets", "url": "https://huggingface.co/datasets/ailsntua/Chordonomicon", "licence": "CC BY-NC 4.0", "revision": "f3a8b67", "use": "counts only" },
  { "id": "key-set-1", "name": "GiantSteps key data, 604 annotated EDM tracks", "url": "https://github.com/GiantSteps/giantsteps-key-dataset", "licence": "no licence stated", "revision": "6bcd492", "use": "counts only" },
  { "id": "key-set-2", "name": "GiantSteps MTG key data, 1,486 annotated EDM tracks", "url": "https://github.com/GiantSteps/giantsteps-mtg-key-dataset", "licence": "no licence stated", "revision": "fd7b8c5", "use": "counts only" },
  { "id": "pop909", "name": "POP909 dataset", "url": "https://github.com/music-x-lab/POP909-Dataset", "licence": "MIT; the songs keep their copyright", "revision": "d83e6ed", "use": "counts only" },
  { "id": "lmd", "name": "Lakh MIDI Dataset, clean subset", "url": "https://colinraffel.com/projects/lmd/", "licence": "CC BY 4.0 for the collection; the songs keep their copyright", "use": "counts only" },
  { "id": "midicaps", "name": "MidiCaps captioned MIDI", "url": "https://huggingface.co/datasets/amaai-lab/MidiCaps", "licence": "CC BY-SA 4.0", "use": "counts only" },
  { "id": "drum-patterns", "name": "GiantSteps drum-pattern datasets", "url": "https://github.com/GiantSteps/drum-pattern-datasets", "licence": "no licence stated", "use": "counts only" },
  { "id": "groove", "name": "Groove MIDI Dataset v1.0.0, Gillick, Roberts, Engel, Eck and Bamman", "url": "https://magenta.tensorflow.org/datasets/groove", "licence": "CC BY 4.0", "use": "counts only" },
  { "id": "temperley-tan", "name": "D. Temperley and D. Tan, Emotional connotations of diatonic modes, Music Perception 30(3), 2013", "url": "https://doi.org/10.1525/mp.2012.30.3.237", "licence": "no licence stated", "use": "facts only" },
  { "id": "eerola", "name": "T. Eerola, A. Friberg and R. Bresin, Emotional expression in music: contribution, linearity, and additivity of primary musical cues, Frontiers in Psychology 4:487, 2013", "url": "https://doi.org/10.3389/fpsyg.2013.00487", "licence": "CC BY 3.0", "use": "facts only" },
  { "id": "camelot", "name": "A key-detection vendor's Camelot and Open Key tables", "url": "https://mixedinkey.com/camelot-wheel", "licence": "no licence stated", "use": "facts only" },
  { "id": "middle-c", "name": "A home-studio table of middle-C labels", "url": "https://homestudio.app/resources/midi-middle-c", "licence": "no licence stated", "use": "facts only" },
  { "id": "serum2-guide", "name": "Serum 2 User Guide, manual 1.0.3, Xfer Records", "url": "https://xferrecords.com/manual/serum-2", "licence": "all rights reserved", "use": "cite only" },
  { "id": "snap-doc", "name": "A DAW vendor's FAQ on keys and scales", "url": "https://help.ableton.com/hc/en-us/articles/11425083250972-Keys-and-Scales-in-Live-12-FAQ", "licence": "no licence stated", "use": "facts only" },
  { "id": "low-interval", "name": "Low-interval-limit charts", "url": "https://www.robin-hoffmann.com/dfsb/low-interval-limits", "licence": "no licence stated", "use": "facts only" }
]
